Date,Day,Platform,Time,Content Summary,Hashtags,Image Type,Link
2026-04-01,Tuesday,Twitter,09:00,Information overload / 3000+ AI articles daily,#AI #Productivity #TechNews,Stat quote card,https://rundailyai.com
2026-04-01,Tuesday,Twitter,16:00,Morning coffee routine / 5 min insights,#AINews #DailyBrief,Product screenshot,https://rundailyai.com/subscribe
2026-04-01,Tuesday,LinkedIn,10:00,130 hours/year on AI news / RunDailyAI solution,#ArtificialIntelligence #Leadership #Productivity,Professional insight card,https://rundailyai.com
2026-04-01,Tuesday,Instagram,12:00,AI news digest just got smarter,#AI #TechNews #Productivity #FutureOfWork #Innovation,Story highlight template,https://rundailyai.com
2026-04-01,Tuesday,Facebook,11:00,Introducing RunDailyAI / 5-min briefings,#AI #Technology #Productivity,Hero image,https://rundailyai.com
2026-04-01,Tuesday,Pinterest,08:00,5 AI Tools Every Professional Should Know,#AITools #Productivity #TechTips,List post template,https://rundailyai.com/blog/essential-ai-tools-2026
2026-04-01,Tuesday,Pinterest,10:00,How to Stay Updated on AI Without Overwhelm,#AI #ProductivityTips #TimeManagement,Featured article,https://rundailyai.com/blog/ai-news-without-overwhelm
2026-04-01,Tuesday,Pinterest,12:00,Daily AI Brief Template - Free Download,#Productivity #AILearning #Templates,Template preview,https://rundailyai.com/free-tools
2026-04-01,Tuesday,Pinterest,14:00,What is RunDailyAI? Your AI News Solution,#AI #Newsletter #TechNews,Brand introduction,https://rundailyai.com/about
2026-04-01,Tuesday,Pinterest,17:00,AI for Beginners: Where to Start in 2026,#AIforBeginners #LearnAI #TechEducation,Infographic list,https://rundailyai.com/blog/ai-basics-beginners
2026-04-02,Wednesday,Twitter,09:00,AI replacing tasks not jobs / mindset shift,#AI #FutureOfWork #CareerGrowth,Quote card,https://rundailyai.com/blog/ai-mindset-shift
2026-04-02,Wednesday,Twitter,15:00,ChatGPT vs Claude vs Gemini vs Perplexity thread,#AI #ChatGPT #Productivity,Comparison grid,https://rundailyai.com/blog/ai-assistant-comparison
2026-04-02,Wednesday,LinkedIn,10:00,3 ways AI changes knowledge work in 2026,#AI #FutureOfWork #Leadership #DigitalTransformation,Insight card,https://rundailyai.com
2026-04-02,Wednesday,Instagram,13:00,AI is the present not the future,#ArtificialIntelligence #TechTrends #Innovation #FutureIsNow #StayAhead,Quote card gradient,https://rundailyai.com
2026-04-02,Wednesday,Facebook,10:00,AI Myth vs Reality infographic post,#AI #SmallBusiness #TechEducation,Myth vs Reality graphic,https://rundailyai.com
2026-04-02,Wednesday,Pinterest,08:00,10 Free AI Tools You Can Use Today,#FreeTools #AI #Productivity,List with tool icons,https://rundailyai.com/free-tools
2026-04-02,Wednesday,Pinterest,10:00,AI Writing Assistant Guide - Which One to Choose,#AIWriting #ContentCreation #Writing,Comparison chart,https://rundailyai.com/blog/ai-writing-assistants
2026-04-02,Wednesday,Pinterest,12:00,Notion AI Tips & Tricks for Better Productivity,#Notion #Productivity #AITools,Tutorial pin,https://rundailyai.com/blog/notion-ai-tips
2026-04-02,Wednesday,Pinterest,14:00,How to Create AI Prompts That Actually Work,#PromptEngineering #AI #Tutorial,Step-by-step guide,https://rundailyai.com/blog/prompt-engineering-basics
2026-04-02,Wednesday,Pinterest,17:00,AI News Sources You Should Follow in 2026,#AI #TechNews #Resources,Resource list,https://rundailyai.com/blog/ai-news-sources
2026-04-03,Thursday,Twitter,09:00,Best AI tool is the one you actually use,#AI #Productivity #Focus,Text card,https://rundailyai.com
2026-04-03,Thursday,Twitter,16:00,This week in AI news roundup,#AINews #TechUpdate,News roundup graphic,https://rundailyai.com/subscribe
2026-04-03,Thursday,LinkedIn,11:00,10 hours of AI news filtered to 3 key insights,#AI #EnterpriseAI #Leadership #Innovation,Stats card,https://rundailyai.com
2026-04-03,Thursday,Instagram,12:00,3 things in AI this week you need to know,#AINews #TechUpdates #StayInformed #WeeklyRoundup #Innovation,Insight card,https://rundailyai.com
2026-04-03,Thursday,Facebook,09:00,Thursday Thought: AI Edition / Quote card,#AI #BusinessStrategy #Innovation,Quote card,https://rundailyai.com/subscribe
2026-04-03,Thursday,Pinterest,08:00-17:00,5 pins on productivity and AI workflows,Various,Various templates,Various blog/product links
2026-04-04,Friday,Twitter,10:00,Friday reminder: best time to learn AI is now,#AI #Learning #FridayMotivation,Motivational card,https://rundailyai.com
2026-04-04,Friday,Twitter,15:00,Weekend reading: AI digest curated,#AI #WeekendReading #TechNews,Newsletter preview,https://rundailyai.com/subscribe
2026-04-04,Friday,LinkedIn,10:00,Friday reality check on AI in business,#AI #BusinessStrategy #Leadership #FridayThoughts,Reality check card,https://rundailyai.com
2026-04-04,Friday,Instagram,13:00,Weekend challenge: try one new AI tool,#AI #WeekendChallenge #TryNewThings #GrowthMindset #TechLife,Challenge card,https://rundailyai.com
2026-04-04,Friday,Facebook,11:00,Happy Friday / Top 3 articles this week,#FridayFeeling #AI #WeeklyRoundup,Top 3 visual,https://rundailyai.com/blog
2026-04-04,Friday,Pinterest,08:00-17:00,5 pins on AI tools and weekend learning,Various,Various templates,Various links
2026-04-05,Saturday,Twitter,10:00,Saturday deep dive: Claude vs ChatGPT writing,#AI #Writing #ClaudeAI,Comparison header,https://rundailyai.com/blog/claude-vs-chatgpt
2026-04-05,Saturday,Twitter,16:00,Tool fit more important than tool features,#AI #Productivity #WorkflowDesign,Insight card,https://rundailyai.com
2026-04-05,Saturday,Instagram,11:00,Saturday mood: learning about AI,#SaturdayVibes #Learning #AI #GrowthMindset #WeekendLearning,Learning aesthetic,https://rundailyai.com
2026-04-05,Saturday,Facebook,10:00,Saturday Morning AI Tips - 3 quick wins,#WeekendTips #AI #Productivity,Weekend tips card,https://rundailyai.com
2026-04-05,Saturday,Pinterest,09:00-18:00,5 pins on weekend learning and AI resources,Various,Various templates,Various links
2026-04-05,Saturday,Reddit,14:00,How I cut research time 60% with AI (r/productivity),None,Text post with detailed workflow,No promo link
2026-04-06,Sunday,Twitter,11:00,Sunday thought: AI won't take your job quote,#SundayThoughts #AI #CareerDevelopment,Quote card,https://rundailyai.com
2026-04-06,Sunday,Twitter,17:00,Tomorrow's RunDailyAI brief preview,#AI #MondayPrep #Newsletter,Newsletter preview,https://rundailyai.com/subscribe
2026-04-06,Sunday,Instagram,12:00,Sunday reset / new AI skills to learn,#SundayReset #NewWeek #AI #Motivation #LearningJourney,Motivational clean design,https://rundailyai.com
2026-04-06,Sunday,Facebook,11:00,Sunday Coffee & AI / Weekly digest post,#SundayReading #AI #WeeklyDigest,Sunday digest layout,https://rundailyai.com/subscribe
2026-04-06,Sunday,Pinterest,09:00-18:00,5 pins on planning and AI learning challenges,Various,Various templates,Various links
2026-04-07,Monday,Twitter,08:00,Monday energy: coffee + RunDailyAI ready,#MondayMotivation #AI #MorningRoutine,Morning aesthetic,https://rundailyai.com
2026-04-07,Monday,Twitter,14:00,This week's AI predictions and noise filtering,#AI #TechNews #MondayPredictions,Prediction card,https://rundailyai.com/subscribe
2026-04-07,Monday,LinkedIn,09:00,New week in AI: enterprise adoption trends,#AI #MondayMorning #Leadership #EnterpriseAI #BusinessStrategy,Week ahead card,https://rundailyai.com
2026-04-07,Monday,Instagram,13:00,New week new AI insights ready to level up,#MondayMotivation #AI #NewWeek #GrowthMindset #TechLife,Monday motivation graphic,https://rundailyai.com
2026-04-07,Monday,Facebook,09:00,Monday Morning Brief / Week ahead in AI,#MondayMotivation #AI #WeeklyUpdate,Monday briefing visual,https://rundailyai.com/subscribe
2026-04-07,Monday,Pinterest,08:00-17:00,5 pins on productivity hacks and planning,Various,Various templates,Various links
2026-04-08,Tuesday,Twitter,09:00,Productivity about doing what matters / AI helps,#Productivity #AI #WorkSmart,Insight quote card,https://rundailyai.com
2026-04-08,Tuesday,Twitter,15:00,The AI productivity stack I actually use,#AITools #ProductivityStack #TechSetup,Stack visual,https://rundailyai.com/blog/ai-productivity-stack
2026-04-08,Tuesday,LinkedIn,10:00,How 50 high-performers use AI / patterns,#Productivity #AI #WorkflowOptimization #Leadership,Research findings,https://rundailyai.com
2026-04-08,Tuesday,Instagram,12:00,Your AI productivity stack simplified,#Productivity #AITools #WorkSmart #Efficiency #TechStack,Essential tools visual,https://rundailyai.com
2026-04-08,Tuesday,Facebook,10:00,Transform productivity with AI by role,#AIProductivity #ProfessionalDevelopment #WorkSmart,Roles infographic,https://rundailyai.com/subscribe
2026-04-08,Tuesday,Pinterest,08:00-17:00,5 pins on AI productivity by profession,Various,Various templates,Various links
2026-04-08,Tuesday,TikTok,Video Idea,POV: discovered AI tools 10x productivity,None,Short form video,Bio link
2026-04-09,Wednesday,Reddit,15:00,Notion + AI workflow saves 10+ hours (r/Notion),None,Detailed value post with screenshots,No promo
